created_at,polarity,subjectivity,sentiment,tweet
2016-12-09 19:02:45,0.0,0.0,0,rt stratisplatform stratis weekly released https co jfblzoi tp blockchain bitcoin startup strat https co lf r gksvb
2016-12-09 19:02:36,0.4,0.8,1,free bitcoin ethereum https co j cwkt f mit salesforce team burst bitcoin bubble december
2016-12-09 19:02:35,0.13636363636363635,0.45454545454545453,0,rt blockcdn blockcdn part new sharing economy internet use https co germp f ethereum bitcoin bblf dapps cro
2016-12-09 19:02:35,0.06818181818181818,0.2897727272727273,0,benefits cryptocurrency new economy future https co nktrjhzlpb blockchain bitcoin https co zpfnl esy
2016-12-09 19:02:34,0.0,0.0,0,da office pennsylvania pays ransom bitcoin https co oghdkhw h https co vhp uo mi https co papo kq h bitcoin
2016-12-09 19:02:22,0.0,0.0,0,rt mscdigital boost career fintech world degree program bitcoin blockchain apply today https co gkiyl
2016-12-09 19:02:21,0.0,0.4,0,current price bitcoin via chain
2016-12-09 19:02:14,0.0,0.0,0,rt kenyanwalstreet bitcoin today hit highest levels almost three years trading itbit exchange month https
2016-12-09 19:02:13,0.0,0.0,0,mit salesforce team burst bitcoin bubble december https co x jhioim
2016-12-09 19:02:09,0.0,0.0,0,thank mention coincap io bitcoin https co qs xdjmoea
2016-12-09 19:02:01,0.0,0.0,0,africa highest mobilemoney adoption rate world via bitcoinmagazine https co c zijrf financialinclusion
2016-12-09 19:01:56,0.0,0.0,0,started trading bitcoin https co r rgk l cb
2016-12-09 19:01:55,1.0,0.3,1,need butcoins got best rates town https co qq qxteab think hooked paxful bitcoin
2016-12-09 19:01:54,0.0,0.4,0,current price bitcoin via chain bitcoin potcoin btc pot potbot https co smcwcufonh
2016-12-09 19:01:53,0.075,0.1,0,rt aceofwallstreet bullish bitcoin next months like world setting bitcoin success
2016-12-09 19:01:45,0.0,0.0,0,rt stratisplatform stratis weekly released https co jfblzoi tp blockchain bitcoin startup strat https co lf r gksvb
2016-12-09 19:01:44,0.0,0.0,0,always trade bitcny openledger https co zn wyfqaml btc crypto cryptocurrencies bitcoin bitcny
2016-12-09 19:01:44,0.0,0.0,0,bitcoin rise january https co imtkzjeat https co htzvhbmmdj
2016-12-09 19:01:40,0.24999999999999997,0.5,1,rt bresslau aceofwallstreet article available anymore good discussion reddit though https co lleqr fzuj
2016-12-09 19:01:33,0.0,0.0,0,forget qr codes nfc bitcoin wallet cards https co rp mipexns bitcoin bitcoin
2016-12-09 19:01:21,0.0,0.0,0,forget qr codes nfc bitcoin wallet cards https co geaft vh w reddit bitcoin
2016-12-09 19:01:21,0.0,0.0,0,transaction times https co peugdrm il reddit bitcoin
2016-12-09 19:01:20,0.0,0.0,0,bitcoin price cryptocurrency btc money cryptochan https co fugihhc https co xbbvsrt lo
2016-12-09 19:01:18,0.2,0.30000000000000004,1,want follow donation real time bitcoin non profit bitgive launches donation tracker via forbes https co vosmm sx
2016-12-09 19:01:17,0.5,0.5,1,rt reuterstech bitcoin hits highest levels almost three years extending gains since india cash shortage https c
2016-12-09 19:01:15,0.0,0.0,0,forget qr codes nfc bitcoin wallet cards https co ekb zdawzl bitcoin
2016-12-09 19:01:15,0.0,0.0,0,rt ageesensri circle terminates bitcoin trading focuses next generation platform https co odiirdejv
2016-12-09 19:01:15,0.0,0.0,0,bitcoin price finds climbing boots https co v gkpru https co ktdqsgkzcp
2016-12-09 19:01:12,-0.05,0.05,0,bitcoin price technical analysis bulls trying harder https co dr ps iiye https co v uxcnp b
2016-12-09 19:01:11,0.0,0.0,0,bid ask
2016-12-09 19:01:10,0.0,0.0,0,rt clm sand rounds bitcoin bitclubnetwork
2016-12-09 19:01:07,0.13636363636363635,0.45454545454545453,0,rt blockcdn blockcdn part new sharing economy internet use https co germp f ethereum bitcoin bblf dapps cro
2016-12-09 19:00:55,0.2,0.2,1,missed bitcoin dont miss pr reg legal block chain miss https co h limmtp crypto blockchain money usa
2016-12-09 19:00:50,0.7,0.6000000000000001,1,mention good feels bitcoin millionaire max keiser
2016-12-09 19:00:43,0.0,0.0,0,judicious buy bitcoins https co bwqefrnx per btc bpi buy bitcoin banktrans
2016-12-09 19:00:41,-0.2,0.65,0,starburst highly addictive bitcoin game btc eth xmr https co lvw yozds https co opahisyozd
2016-12-09 19:00:39,0.0,0.0,0,bitcoin hits highest levels almost three years https co nqvuhndvhj https co z rlpbfvii
2016-12-09 19:00:35,0.0,0.0,0,price bitcoin coinbase usd
2016-12-09 19:00:34,0.0,1.0,0,rt stashcrypto final hours purchase stash node pro founders edition bitcoin fintech blockchain https co bry tdjw z
2016-12-09 19:00:32,0.5399999999999999,0.72,1,yabtcl complete provably fair bitcoin lottery greatest jackpots also free lottery yabtcl
2016-12-09 19:00:31,0.0,0.0,0,frontier blockchain adoption bitcoin circa https co kwqxmg usk
2016-12-09 19:00:29,0.0890151515151515,0.2606060606060606,0,new blockchain social media platform steemit pays post vote online https co pypk qp j cryptocurrency altcoin bitcoin
2016-12-09 19:00:29,0.0,0.0,0,rt kennethlonyc things know ibm blockchain ecosystem https co flmgaofey fintech bitcoin https co wl ht ehs
2016-12-09 19:00:27,0.4,0.8,1,accepting litecoin https co c fvvtdp join free accept altcoins btc free https co xztdd pk p
2016-12-09 19:00:24,0.0,0.0,0,gdax bitfinex btce bitstamp itbit gemini bitcoin news https co vpwodp
2016-12-09 19:00:24,-0.15,0.39999999999999997,0,rt bitcoinprice average price bitcoin across exchanges usd
2016-12-09 19:00:24,0.0,0.0,0,bitcoin give n today register mega zarfund team start getting bitcoins register https co nxsl htqr
2016-12-09 19:00:23,0.13636363636363635,0.45454545454545453,0,rt blockcdn blockcdn part new sharing economy internet use https co germp f ethereum bitcoin bblf dapps cro
2016-12-09 19:00:23,0.375,0.5666666666666667,1,get first free bitcoins try earn https co x bitcoin btc december pm
2016-12-09 19:00:20,0.125,0.125,0,like digital magazine please consider supporting us visit https co u ajyqzjg support bitcoin https co dmpcb r b
2016-12-09 19:00:18,0.0,0.0,0,price update bitcoin cryptocurrency source https co aazu v via flutter hq
2016-12-09 19:00:14,0.2,0.4,1,next crypto currency bitcoin called ilcoin join free today click https co e v lrm md
2016-12-09 19:00:10,0.0,0.0,0,rt stratisplatform stratis weekly released https co jfblzoi tp blockchain bitcoin startup strat https co lf r gksvb
2016-12-09 19:00:10,0.0,0.0,0,bitcoin price index https co uchjuhc usd eur cny gbp rub https co hqfwz uuc
2016-12-09 19:00:08,0.85,1.0,1,another day beautiful day https co eogc ddhdu bitcoin poker forum rewards casino bonus zs
2016-12-09 19:00:08,0.0,0.1,0,soccer dijon vs marseille starting bitcoin matched https co nw rzgk hr https co nzk qcps
2016-12-09 19:00:07,0.0,0.0,0,btc bitcoin quotes bitstamp btce coinbase
2016-12-09 19:00:07,0.15333333333333332,0.3133333333333333,0,one bitcoin worth bitstamp high low market cap billion bitcoin https co hyxnznkqsr
2016-12-09 19:00:06,0.3,0.1,1,one bitcoin worth market cap billion based coindesk bpi bitcoin
2016-12-09 19:00:06,0.5,0.525,1,best bitcoin faucet day voted times moon bitcoin https co saipkcs ke total votes
2016-12-09 19:00:03,-0.15,0.39999999999999997,0,average price bitcoin across exchanges usd
2016-12-09 19:00:03,0.0,0.0,0,rt reuters bitcoin hits highest levels almost three years https co jtfv xgudj https co sqejryqegi
2016-12-09 19:00:02,0.0,0.0,0,bitcoin give n today learn start getting bitcoins join mega zarfund whatsapp group https co gdymww wfz
2016-12-09 19:00:02,1.0,1.0,1,vircurex frc btc happy trading https co hcllau di vircurex freicoin bitcoin trade rt
2016-12-09 19:00:01,-0.15,0.39999999999999997,0,average bitcoin market price usd eur
2016-12-09 19:00:01,0.0,0.0,0,bitcoin give n today learn start getting bitcoins join mega zarfund whatsapp group https co beq k augy
2016-12-09 19:00:00,0.4,0.2,1,win bitcoin daily drawing details twin blasts hit adamawa market https co biyglylrbu
2016-12-09 18:59:54,0.0,0.0,0,rt stratisplatform stratis announcement tuesday regarding anonymity transaction privacy tech c utilise nstratis blockc
2016-12-09 18:59:51,0.0,0.0,0,rt stratisplatform announcement anonymous transactions coming stratis https co assqc qxiw blockchain privacy bitcoin startup
2016-12-09 18:59:39,0.0,0.0,0,fintech democratizing markets details https co sixeorfkbz click https co tk lodyth bitcoin https co vkwby b pl
2016-12-09 18:59:28,0.0,0.0,0,pt departure online gamble campaign ireland scotland befair ponzi scheme cousin https co deozk wfwp
2016-12-09 18:59:28,0.0,0.0,0,rt reuters bitcoin hits highest levels almost three years https co jtfv xgudj https co sqejryqegi
2016-12-09 18:59:24,0.0,0.0,0,profit sharing opportunity kiosk placement bitcoin atm via r batonrouge https co ofexz
2016-12-09 18:59:21,0.0,0.06666666666666667,0,bitcoin price change last h bitcoin price https co ltqa rc
2016-12-09 18:59:16,0.0,0.0,0,sitophobia fear food eating bitcoin btc
2016-12-09 18:58:59,0.13636363636363635,0.45454545454545453,0,rt blockcdn blockcdn part new sharing economy internet use https co germp f ethereum bitcoin bblf dapps cro
2016-12-09 18:58:56,0.4,0.6,1,secure healthcare business collaboration enabled cloud https co q vwq rq k cnnnews blockchain bitcoin
2016-12-09 18:58:47,0.0,0.0,0,rt themerklenews canadian bitcoin holders still using galaxy note cut next week https co rddprzlovc
2016-12-09 18:58:44,-1.0,1.0,0,bitcoin tracker outrageous prediction https co uw ukw vhw
2016-12-09 18:58:43,0.0,0.0,0,bitcoin hits highest levels almost three years https co dpeq mrdvf https co mnn go c
2016-12-09 18:58:42,0.0,0.0,0,rt bitcoinadvice sell bitcoin btc
2016-12-09 18:58:22,0.0,0.0,0,mit salesforce team burst bitcoin bubble december https co q df svdth crypto https co rymvbghjog
2016-12-09 18:58:22,0.0,0.0,0,rt btctn darcrus enterprise everywhere https co axhaomq https co wipdzg yes
2016-12-09 18:58:19,0.0,0.0,0,darcrus founder gives overview waves weekly https co vq w zvetu blockchain crowdfunding fintech bitcoin startup dar
2016-12-09 18:58:13,0.2,0.2,1,rt edgemaster check https co aofyn jjzb thanks bitconnect co darcrus darcus dar
2016-12-09 18:58:07,0.0,0.125,0,rt block talk tonight blocktalk ryanxcharles yoursnetwork decentralized blockchain future bitcoin btc reddit https
2016-12-09 18:58:06,0.78125,0.5,1,top trusted faucet rotator list https co c iojbhdbq bitcoin
2016-12-09 18:58:04,0.35,0.5,1,oppg le pfncng qw btc free lottery let fun https co zek qcjg yabtcl bitcoin
2016-12-09 18:57:45,0.0,0.0,0,rt andreagrimes every time think pitch expert four dudes university nope emailed unsolicit
2016-12-09 18:57:45,0.0,0.0,0,nou concepte maas mining service nicehash https co lb mksp gb maas bitcoin mining nicehash nicehashmining
2016-12-09 18:57:44,0.0,1.0,0,survive apocalypse bitcoin oracle
2016-12-09 18:57:44,0.30000000000000004,0.65,1,rt deray never understood whole bitcoin phase craze bitcoin still relevant
2016-12-09 18:57:38,0.0,0.0,0,canadian bitcoin holders still using galaxy note cut next week https co iryn dqaxw bitcoin blockchain crypto news
2016-12-09 18:57:29,0.0,0.0,0,grabs bounty bugs https co zotz pqmhi bitcoin jobs
2016-12-09 18:57:29,0.0,0.0,0,hiring intermediate statistics tutor https co bxgchuslkv bitcoin jobs
2016-12-09 18:57:26,-0.1,0.4,0,rt coinenablers bitstamp tries crowdfunding route million valuation https co grd evnqwr
2016-12-09 18:57:13,0.0,0.0,0,fintech blockchain overrated bitcoin underrated https co uvpy roido via cointelegraph blockchain bitcoin
2016-12-09 18:57:05,0.25,0.3333333333333333,1,rt minebitcoin btc robot world first automated bitcoin trading bot https co qpbgspktnj https co mqij hgkd
2016-12-09 18:57:04,0.033333333333333326,0.6666666666666666,0,mr ghostly botnet hunter kind sorry mate testing wonder ever big bugs bitcoin part
2016-12-09 18:57:00,0.0,0.75,0,rt mercatoxcom mercatox exchange statistics volume h btc deals total users total btc altcoin ltc ethe
